{"apiVersion":"kora.dev/v0alpha1","graph":{"source":"graph/workflow.json"},"inputs":{"schema":"schemas/input.schema.json"},"integrity":{"algorithm":"sha256","files":{"README.md":"43e52314281f2b36ea8330d01ccb437dffeab3d8bea5b6f7d7d72a4a09c0b62f","conformance/cases/echo-success.json":"6b7c248365deb45777f280b6640f8ebcb959afa95e9153c165d3a22850558ea4","examples/input.json":"f871cee9cee87583561701f837e061b43ad6c69475cb7a8e66bae6fd3e40e802","graph/workflow.json":"a044e9b3002487ad30f4500634156bebbff0c70e8041185e3b60d096776694db","schemas/input.schema.json":"b7c3045d93241f2c9a71d83838e466295e6586fc195d847845e9d99948f217ab","schemas/output.schema.json":"b7c3045d93241f2c9a71d83838e466295e6586fc195d847845e9d99948f217ab"}},"kind":"Solution","metadata":{"id":"example.generated-echo","version":"0.1.0"},"outputs":{"schema":"schemas/output.schema.json"},"policy":{"approvals":[],"network":"denied","sideEffects":[]},"requires":{"capabilities":["det.echo"],"kora":">=0.1.0a0,<0.2"}}
